{
  "$schema": "https://benheroblaw.github.io/meta_schema.json",
  "author": "benheroblaw",
  "title": "_test stuff",
  "rating": 1,
  "warnings": "swearing and obscenities ;) {comes with coding :P}",
  "credits": "me for writing the text viewer :3",
  "links": "https://benheroblaw.github.io/, but that's prolly where you got this :P"
}